### ISSUE TITLE
Kinan sometimes connects to the proxy without authentication

### ISSUE THREAD

**Issue by Mygod** [drallieiv/KinanCity#140]
This only happens occasionally from what I can see. This causes issues since some proxy returns garbage without authentication to hide itself from probes. Is it possible to fix?

**Comment by Mygod** [comment]
Here's a complete tcpdump of an example faulty connection.

```
21:33:27.675460 IP (tos 0x0, ttl 52, id 18629, offset 0, flags [DF], proto TCP (6), length 60)
    client > server: Flags [S], cksum 0xb4c7 (correct), seq 2739447964, win 64240, options [mss 1460,sackOK,TS val 3173664601 ecr 0,nop,wscale 7], length 0
E..<H.@.4.].%;/"-+.......H.....................
.*GY........
21:33:27.675509 IP (tos 0x0, ttl 64, id 0, offset 0, flags [DF], proto TCP (6), length 60)
    server > client: Flags [S.], cksum 0xa090 (incorrect -> 0xec3e), seq 1489813761, ack 2739447965, win 43440, options [mss 1460,sackOK,TS val 1646697919 ecr 3173664601,nop,wscale 11], length 0
E..<..@.@..Z-+..%;/"....X....H.................
b&...*GY....
21:33:27.824743 IP (tos 0x0, ttl 52, id 18630, offset 0, flags [DF], proto TCP (6), length 52)
    client > server: Flags [.], cksum 0xc233 (correct), seq 1, ack 1, win 502, options [nop,nop,TS val 3173664751 ecr 1646697919], length 0
E..4H.@.4.].%;/"-+.......H..X........3.....
.*G.b&..
21:33:27.824786 IP (tos 0x0, ttl 52, id 18631, offset 0, flags [DF], proto TCP (6), length 177)
    client > server: Flags [P.], cksum 0xe166 (correct), seq 1:126, ack 1, win 502, options [nop,nop,TS val 3173664751 ecr 1646697919], length 125
E...H.@.4.].%;/"-+.......H..X........f.....
.*G.b&..CONNECT club.pokemon.com:443 HTTP/1.1
Host: club.pokemon.com:443
Proxy-Connection: Keep-Alive
User-Agent: okhttp/3.6.0


21:33:27.824796 IP (tos 0x0, ttl 64, id 7487, offset 0, flags [DF], proto TCP (6), length 52)
    server > client: Flags [.], cksum 0xa088 (incorrect -> 0xc301), seq 1, ack 126, win 22, options [nop,nop,TS val 1646698068 ecr 3173664751], length 0
E..4.?@.@.}#-+..%;/"....X....H.............
b&.T.*G.
21:33:27.825797 IP (tos 0x0, ttl 64, id 7488, offset 0, flags [DF], proto TCP (6), length 227)
    server > client: Flags [P.], cksum 0xa137 (incorrect -> 0x6153), seq 1:176, ack 126, win 22, options [nop,nop,TS val 1646698069 ecr 3173664751], length 175
E....@@.@.|s-+..%;/"....X....H.......7.....
b&.U.*G.HTTP/1.1 407 Proxy Authentication Required
```

**Comment by Mygod** [comment]
Just for context, a normal initiating HTTP proxy request would have included the `Proxy-Authorization` header, and Kinan does send it occasionally when it feels like it, which is very rude.

**Comment by exiva** [comment]
@drallieiv Submitted a PR for this.
